Symbol,Name,Last Sale,Net Change,% Change,Market Cap,Country,IPO Year,Volume,Sector,Industry
QMCO,Quantum Corporation Common Stock,$0.4306,-0.0284,-6.187%,41272983.00,United States,,494165,Technology,Electronic Components
QNCX,Quince Therapeutics Inc. Common Stock,$0.75,0.00,0.00%,32411425.00,United States,2019,50994,Health Care,Biotechnology: Biological Products (No Diagnostic Substances)
QNRX,Quoin Pharmaceuticals Ltd. American Depositary Shares,$0.67,0.0159,2.431%,2666580.00,Israel,2016,32478,Health Care,Medical/Dental Instruments
QNST,QuinStreet Inc. Common Stock,$18.29,1.26,7.399%,1011012727.00,United States,2010,451064,Consumer Discretionary,Business Services
QOMO,Qomolangma Acquisition Corp. Common Stock,$11.01,0.01,0.091%,0.00,United States,2022,1250,Finance,Blank Checks
QQQX,Nuveen NASDAQ 100 Dynamic Overwrite Fund Shares of Beneficial Interest,$25.62,-0.07,-0.272%,0.00,United States,,214746,Finance,Finance Companies
QRHC,Quest Resource Holding Corporation Common Stock,$9.22,0.21,2.331%,186518950.00,United States,,68751,Utilities,Environmental Services
QRTEA,Qurate Retail Inc. Series A Common Stock ,$0.7919,0.0214,2.777%,314272678.00,United States,,2541226,Consumer Discretionary,Catalog/Specialty Distribution
QRTEB,Qurate Retail Inc. Series B Common Stock ,$4.20,0.10,2.439%,1666807989.00,United States,,1343,Consumer Discretionary,Catalog/Specialty Distribution
QRTEP,Qurate Retail Inc. 8.0% Fixed Rate Cumulative Redeemable Preferred Stock,$41.50,0.14,0.338%,16469650368.00,United States,,20411,Consumer Discretionary,Catalog/Specialty Distribution
QRVO,Qorvo Inc. Common Stock,$129.21,2.89,2.288%,12356235365.00,United States,,1393980,Technology,Semiconductors
QSG,QuantaSing Group Limited American Depositary Shares,$1.71,-0.02,-1.156%,94402520.00,China,2023,36544,Real Estate,Other Consumer Services
QSI,Quantum-Si Incorporated Class A Common Stock,$1.22,0.14,12.963%,173016117.00,United States,2020,1030001,Industrials,Industrial Machinery/Components
QSIAW,Quantum-Si Incorporated Warrant,$0.19,0.0082,4.51%,26945133.00,United States,2020,3883,Industrials,Industrial Machinery/Components
QTI,QT Imaging Holdings Inc. Common Stock,$0.703,-0.0273,-3.738%,15073315.00,United States,,86424,Health Care,Biotechnology: Electromedical & Electrotherapeutic Apparatus
QTRX,Quanterix Corporation Common Stock,$16.36,1.28,8.488%,626098640.00,United States,2017,790416,Industrials,Biotechnology: Laboratory Analytical Instruments
QTTB,Q32 Bio Inc. Common Stock,$26.68,0.90,3.491%,318616002.00,United States,2018,64906,Health Care,Biotechnology: Pharmaceutical Preparations
QUBT,Quantum Computing Inc. Common Stock,$0.71,0.0111,1.588%,64863924.00,United States,,2754377,Technology,Computer Software: Prepackaged Software
QUIK,QuickLogic Corporation Common Stock,$12.79,0.53,4.323%,184483254.00,United States,1999,248455,Technology,Semiconductors
QURE,uniQure N.V. Ordinary Shares,$9.21,0.10,1.098%,447140315.00,Netherlands,2014,2471286,Health Care,Biotechnology: Pharmaceutical Preparations
QXO,QXO Inc. Common Stock,$54.50,1.55,2.927%,36212416.00,United States,,19357,Technology,EDP Services
RAIL,FreightCar America Inc. Common Stock,$3.13,0.06,1.954%,58564134.00,United States,2005,26826,Industrials,Railroads
RAND,Rand Capital Corporation Common Stock,$17.79,0.69,4.035%,45916364.00,United States,,1163,Finance,Finance: Consumer Services
RANI,Rani Therapeutics Holdings Inc. Class A Common Stock,$3.95,-0.04,-1.003%,199160244.00,United States,2021,189781,Health Care,Biotechnology: Pharmaceutical Preparations
RAPP,Rapport Therapeutics Inc. Common Stock,$27.57,2.57,10.28%,975328919.00,United States,2024,120811,Health Care,Biotechnology: Pharmaceutical Preparations
RAPT,RAPT Therapeutics Inc. Common Stock,$3.75,0.18,5.042%,130888035.00,United States,2019,287990,Health Care,Biotechnology: Pharmaceutical Preparations
RARE,Ultragenyx Pharmaceutical Inc. Common Stock,$45.27,0.81,1.822%,3763446347.00,United States,2014,828036,Health Care,Biotechnology: Pharmaceutical Preparations
RAVE,Rave Restaurant Group Inc. Common Stock,$1.865,0.005,0.269%,27203946.00,United States,,8481,Consumer Discretionary,Food Distributors
RAY,Raytech Holding Limited Ordinary Shares,$3.26,-0.01,-0.306%,57050000.00,Hong Kong,2024,69924,Consumer Discretionary,Consumer Electronics/Appliances
RAYA,Erayak Power Solution Group Inc. Class A Ordinary Shares,$0.86,0.00,0.00%,10707000.00,China,2022,328,Consumer Discretionary,Metal Fabrications
RBB,RBB Bancorp Common Stock,$21.70,1.02,4.932%,400153946.00,United States,2017,186632,Finance,Major Banks
RBBN,Ribbon Communications Inc. Common Stock,$3.90,0.06,1.563%,678248559.00,United States,,479854,Technology,EDP Services
RBCAA,Republic Bancorp Inc. Class A Common Stock,$61.73,3.25,5.557%,1198315970.00,United States,1998,29411,Finance,Major Banks
RBKB,Rhinebeck Bancorp Inc. Common Stock,$8.37,0.27,3.333%,92677721.00,United States,2019,2311,Finance,Banks
RCAT,Red Cat Holdings Inc. Common Stock,$1.91,0.15,8.523%,141877703.00,United States,,1266682,Technology,Computer Software: Prepackaged Software
RCEL,Avita Medical Inc. Common Stock,$10.40,0.54,5.477%,268317244.00,United States,,202220,Health Care,Medical/Dental Instruments
RCKT,Rocket Pharmaceuticals Inc. Common Stock,$23.35,0.80,3.548%,2119764627.00,United States,2015,580159,Health Care,Biotechnology: Pharmaceutical Preparations
RCKTW,Rocket Pharmaceuticals Inc. Warrant,$0.0734,-0.0001,-0.136%,,United States,,85,Health Care,Biotechnology: Pharmaceutical Preparations
RCKY,Rocky Brands Inc. Common Stock,$37.12,2.97,8.697%,275548479.00,United States,1993,51921,Consumer Discretionary,Shoe Manufacturing
RCM,R1 RCM Inc. Common Stock,$13.03,0.24,1.876%,5488955647.00,United States,,2235581,Consumer Discretionary,Other Consumer Services
RCMT,RCM Technologies Inc. Common Stock,$19.90,0.43,2.209%,154294013.00,United States,,20766,Consumer Discretionary,Professional Services
RCON,Recon Technology Ltd. Class A Ordinary Shares,$1.58,0.04,2.597%,23665170.00,China,2009,5853,Energy,Oilfield Services/Equipment
RCRT,Recruiter.com Group Inc. Common Stock,$2.17,0.10,4.831%,5864047.00,United States,,21069,Technology,EDP Services
RCRTW,Recruiter.com Group Inc. Warrant,$0.0051,0.0011,27.50%,13782.00,United States,,31092,Technology,EDP Services
RDCM,Radcom Ltd. Ordinary Shares,$9.435,0.225,2.443%,144428451.00,Israel,1997,35322,Technology,Computer peripheral equipment
RDFN,Redfin Corporation Common Stock,$8.48,0.21,2.539%,1013113071.00,United States,2017,7895897,Finance,Real Estate
RDHL,Redhill Biopharma Ltd. American Depositary Shares,$0.4045,0.0038,0.948%,12890199.00,Israel,,228441,Health Care,Biotechnology: Pharmaceutical Preparations
RDI,Reading International Inc Class A Common Stock,$1.45,0.05,3.571%,32518293.00,United States,,6023,Consumer Discretionary,Movies/Entertainment
RDIB,Reading International Inc Class B Common Stock,$13.35,-0.60,-4.301%,299392560.00,United States,,747,Consumer Discretionary,Movies/Entertainment
RDNT,RadNet Inc. Common Stock,$65.16,2.47,3.94%,4814030248.00,United States,,697559,Health Care,Medical Specialities
RDUS,Radius Recycling Inc. Class A Common Stock,$17.87,1.04,6.179%,501065043.00,United States,,257468,Consumer Discretionary,Industrial Specialties
RDVT,Red Violet Inc. Common Stock ,$26.15,0.15,0.577%,359053699.00,United States,,57890,Technology,Computer Software: Prepackaged Software
RDWR,Radware Ltd. Ordinary Shares,$18.58,0.23,1.253%,774765116.00,Israel,1999,330067,Consumer Discretionary,Business Services
RDZN,Roadzen Inc. Ordinary Shares,$2.38,0.04,1.709%,162889173.00,United States,2022,239113,Finance,Specialty Insurers
RDZNW,Roadzen Inc. Warrants,$0.06,0.008,15.385%,4106450.00,United States,2022,2504,Finance,Specialty Insurers
REAL,The RealReal Inc. Common Stock,$3.745,0.245,7.00%,396854598.00,United States,2019,2160252,Consumer Discretionary,Other Specialty Stores
REAX,The Real Brokerage Inc. Common Shares,$5.67,0.17,3.091%,1073331000.00,Canada,,1650796,Finance,Real Estate
REBN,Reborn Coffee Inc. Common Stock,$5.65,0.41,7.824%,15347507.00,United States,2022,146264,Consumer Discretionary,Restaurants
RECT,Rectitude Holdings Ltd Ordinary Shares,$3.3597,0.1038,3.188%,49723560.00,Singapore,2024,29898,Consumer Discretionary,Industrial Machinery/Components
REE,REE Automotive Ltd. Class A Ordinary Shares,$4.58,0.10,2.232%,51446361.00,Israel,,45851,Consumer Discretionary,Auto Manufacturing
REFI,Chicago Atlantic Real Estate Finance Inc. Common Stock,$16.00,0.22,1.394%,305604512.00,United States,2021,160843,Real Estate,Real Estate Investment Trusts
REFR,Research Frontiers Incorporated Common Stock,$2.04,-0.01,-0.488%,68376285.00,United States,,25496,Miscellaneous,Multi-Sector Companies
REG,Regency Centers Corporation Common Stock,$65.13,0.94,1.464%,12034662262.00,United States,1993,672742,Real Estate,Real Estate Investment Trusts
REGCO,Regency Centers Corporation 5.875% Series B Cumulative Redeemable Preferred Stock,$21.98,0.2073,0.952%,4061444442.00,United States,,8986,,
REGCP,Regency Centers Corporation 6.25% Series A Cumulative Redeemable Preferred Stock,$23.25,0.0156,0.067%,4296113889.00,United States,,3960,,
REGN,Regeneron Pharmaceuticals Inc. Common Stock,$1094.99,12.88,1.19%,120652023930.00,United States,1991,282364,Health Care,Biotechnology: Pharmaceutical Preparations
REKR,Rekor Systems Inc. Common Stock,$2.04,0.09,4.615%,174130834.00,United States,,1328306,Telecommunications,Telecommunications Equipment
RELI,Reliance Global Group Inc. Common Stock,$3.98,-0.14,-3.398%,3665580.00,United States,,57179,Finance,Specialty Insurers
RELL,Richardson Electronics Ltd. Common Stock,$12.90,0.56,4.538%,184191889.00,United States,1983,119476,Technology,Electronic Components
RELY,Remitly Global Inc. Common Stock,$13.48,-0.05,-0.37%,2594638852.00,United States,2021,1630835,Consumer Discretionary,Business Services
RENB,Renovaro Inc. Common Stock,$1.42,0.02,1.429%,209457020.00,United States,,143741,Health Care,Biotechnology: Pharmaceutical Preparations
RENE,Cartesian Growth Corporation II Class A Ordinary Shares,$11.32,0.00,0.00%,0.00,United States,2022,5214,Finance,Blank Checks
RENEW,Cartesian Growth Corporation II Warrant,$0.135,0.041,43.617%,0.00,United States,2022,1666,Finance,Blank Checks
RENT,Rent the Runway Inc. Class A Common Stock,$18.84,0.97,5.428%,70118222.00,United States,2021,46273,Consumer Discretionary,Other Specialty Stores
REPL,Replimune Group Inc. Common Stock,$11.06,0.25,2.313%,679251061.00,United States,2018,1371595,Health Care,Biotechnology: Biological Products (No Diagnostic Substances)
RETO,ReTo Eco-Solutions Inc. Common Shares,$1.42,0.05,3.65%,5318168.00,China,2017,38091,Industrials,Industrial Machinery/Components
REVB,Revelation Biosciences Inc. Common Stock,$1.86,-0.01,-0.535%,3037259.00,United States,2020,363752,Health Care,Biotechnology: Pharmaceutical Preparations
REVBW,Revelation Biosciences Inc. Warrant,$0.0143,0.0004,2.878%,23351.00,United States,2020,1000,Health Care,Biotechnology: Pharmaceutical Preparations
REYN,Reynolds Consumer Products Inc. Common Stock,$27.16,0.40,1.495%,5707342784.00,United States,2020,343051,Consumer Discretionary,Containers/Packaging
RFAC,RF Acquisition Corp. Class A Common Stock,$11.10,0.00,0.00%,0.00,Singapore,2022,10094,Finance,Blank Checks
RFACU,RF Acquisition Corp. Unit,$11.07,0.00,0.00%,0.00,Singapore,2022,6,Finance,Blank Checks
RFAI,RF Acquisition Corp II Ordinary Shares,$10.07,0.01,0.099%,0.00,Singapore,2024,161702,,
RFAIR,RF Acquisition Corp II Right,$0.07,0.00,0.00%,0.00,Singapore,2024,80728,Finance,Blank Checks
RFAIU,RF Acquisition Corp II Unit,$10.14,0.01,0.099%,0.00,Singapore,2024,10430,Finance,Blank Checks
RFIL,RF Industries Ltd. Common Stock,$4.42,-0.02,-0.45%,46390322.00,United States,,18330,Technology,Electrical Products
RGC,Regencell Bioscience Holdings Limited Ordinary Shares,$3.2036,-0.1464,-4.37%,41688018.00,Hong Kong,2021,342,Health Care, Medicinal Chemicals and Botanical Products 
RGCO,RGC Resources Inc. Common Stock,$22.77,0.77,3.50%,231823875.00,United States,,34433,Utilities,Oil & Gas Production
RGEN,Repligen Corporation Common Stock,$135.00,12.40,10.114%,7543245690.00,United States,1986,826712,Health Care,Biotechnology: Biological Products (No Diagnostic Substances)
RGF,The Real Good Food Company Inc. Class A Common Stock,$0.5075,0.0018,0.356%,17094734.00,United States,2021,59502,Consumer Staples,Packaged Foods
RGLD,Royal Gold Inc. Common Stock,$140.06,3.26,2.383%,9206572664.00,United States,,331989,Industrials,Precious Metals
RGLS,Regulus Therapeutics Inc. Common Stock,$1.78,0.04,2.299%,116529259.00,United States,2012,532204,Health Care,Biotechnology: Pharmaceutical Preparations
RGNX,REGENXBIO Inc. Common Stock,$13.56,0.69,5.361%,667910899.00,United States,2015,440563,Health Care,Biotechnology: Biological Products (No Diagnostic Substances)
RGP,Resources Connection Inc. Common Stock,$10.96,0.65,6.305%,370529751.00,United States,,448108,Consumer Discretionary,Business Services
RGS,Regis Corporation Common Stock,$20.99,0.15,0.72%,47856109.00,United States,1991,70977,Consumer Discretionary,Other Consumer Services
RGTI,Rigetti Computing Inc. Common Stock,$1.28,0.09,7.563%,220056699.00,United States,,7378863,Technology,EDP Services
RGTIW,Rigetti Computing Inc. Warrants,$0.1513,-0.0147,-8.855%,26011389.00,United States,,96261,Technology,EDP Services
RICK,RCI Hospitality Holdings Inc. Common Stock,$48.03,1.75,3.781%,447885370.00,United States,1995,152547,Consumer Discretionary,Restaurants
RIGL,Rigel Pharmaceuticals Inc. Common Stock,$11.25,0.66,6.232%,197530808.00,United States,2000,150665,Health Care,Biotechnology: Pharmaceutical Preparations
RILY,B. Riley Financial Inc. Common Stock,$17.43,0.76,4.559%,528047131.00,United States,,989602,Finance,Investment Managers
RILYG,B. Riley Financial Inc. 5.00% Senior Notes due 2026,$17.65,-0.29,-1.616%,534712098.00,United States,,25972,Finance,Investment Managers
RILYK,B. Riley Financial Inc. 5.50% Senior Notes Due 2026,$21.20,0.06,0.284%,642260424.00,United States,,15696,Finance,Investment Managers
RILYL,B. Riley Financial Inc. Depositary Shares each representing 1/1000th in a share of 7.375% Series B Cumulative Perpetual Preferred Stock par value $0.0001,$21.9999,0.2799,1.289%,666493636.00,United States,,10459,Finance,Investment Managers
RILYM,B. Riley Financial Inc. 6.375% Senior Notes due 2025,$24.09,-0.06,-0.248%,729813849.00,United States,,47141,Finance,Investment Managers
RILYN,B. Riley Financial Inc. 6.50% Senior Notes Due 2026,$18.92,0.05,0.265%,573187133.00,United States,,31144,Finance,Investment Managers
RILYP,B. Riley Financial Inc. Depositary Shares each representing a 1/1000th fractional interest in a share of Series A Cumulative Perpetual Preferred Stock,$18.72,0.0309,0.165%,567128072.00,United States,,12665,Finance,Investment Managers
RILYT,B. Riley Financial Inc. 6.00% Senior Notes Due 2028,$17.275,-0.145,-0.832%,523351359.00,United States,,17041,Finance,Investment Managers
RILYZ,B. Riley Financial Inc. 5.25% Senior Notes due 2028,$14.72,-0.08,-0.541%,445946860.00,United States,,89887,Finance,Investment Managers
RIOT,Riot Platforms Inc. Common Stock ,$12.70,1.22,10.627%,3667568814.00,United States,,44936283,Finance,Finance: Consumer Services
RIVN,Rivian Automotive Inc. Class A Common Stock,$17.94,0.44,2.514%,17856044962.00,United States,2021,43843664,Consumer Discretionary,Auto Manufacturing
RKDA,Arcadia Biosciences Inc. Common Stock,$3.00,-0.055,-1.80%,4088520.00,United States,2015,4316,Consumer Staples,Farming/Seeds/Milling
RKLB,Rocket Lab USA Inc. Common Stock,$5.63,-0.09,-1.573%,2774349801.00,United States,2020,10319910,Industrials,Military/Government/Technical
RLAY,Relay Therapeutics Inc. Common Stock,$8.98,0.71,8.585%,1192020259.00,United States,2020,1914557,Health Care,Biotechnology: Biological Products (No Diagnostic Substances)
RLMD,Relmada Therapeutics Inc. Common Stock,$3.77,-0.07,-1.823%,113756742.00,United States,,63870,Health Care,Biotechnology: Pharmaceutical Preparations
RLYB,Rallybio Corporation Common Stock,$1.45,0.11,8.209%,60101481.00,United States,2021,154607,Health Care,Biotechnology: Pharmaceutical Preparations
RMBI,Richmond Mutual Bancorporation Inc. Common Stock,$12.33,0.63,5.385%,136437109.00,United States,2019,15806,Finance,Major Banks
RMBL,RumbleOn Inc. Class B Common Stock,$4.80,0.42,9.589%,169234752.00,United States,,444921,Technology,EDP Services
RMBS,Rambus Inc. Common Stock,$65.28,0.39,0.601%,7035926968.00,United States,1997,997392,Technology,Semiconductors
RMCF,Rocky Mountain Chocolate Factory Inc. Common Stock,$2.0501,-0.1249,-5.743%,12982271.00,United States,,64953,Consumer Staples,Specialty Foods
RMCO,Royalty Management Holding Corporation Class A Common Stock,$1.12,0.202,22.004%,16759786.00,United States,2023,53278,Miscellaneous,Multi-Sector Companies
RMCOW,Royalty Management Holding Corporation Warrant,$0.0181,0.0006,3.429%,270850.00,United States,2023,4706,Miscellaneous,Multi-Sector Companies
RMNI,Rimini Street Inc. (DE) Common Stock,$3.16,0.09,2.932%,285695600.00,United States,2015,219051,Consumer Discretionary,Business Services
RMR,The RMR Group Inc. Class A Common Stock,$25.71,0.69,2.758%,815794472.00,United States,,193494,Consumer Discretionary,Professional Services
RMTI,Rockwell Medical Inc. Common Stock,$2.08,-0.07,-3.256%,63056623.00,United States,1998,125658,Health Care,Biotechnology: Pharmaceutical Preparations
RNA,Avidity Biosciences Inc. Common Stock,$46.68,1.06,2.324%,4464323397.00,United States,2020,1231881,Health Care,Biotechnology: Pharmaceutical Preparations
RNAC,Cartesian Therapeutics Inc. Common Stock,$18.00,0.08,0.446%,320328954.00,United States,2016,189754,Health Care,Biotechnology: Pharmaceutical Preparations
RNAZ,TransCode Therapeutics Inc. Common Stock,$0.98,0.0797,8.853%,6489612.00,United States,2021,243069,Health Care,Biotechnology: Pharmaceutical Preparations
RNLX,Renalytix plc American Depositary Shares,$0.3439,0.0139,4.212%,26543611.00,United Kingdom,2020,1463078,Health Care,Medical Specialities
RNW,ReNew Energy Global plc Class A Ordinary Shares,$6.04,0.24,4.138%,486579199.00,United Kingdom,,2506895,Utilities,Electric Utilities: Central
RNWWW,ReNew Energy Global plc Warrant,$0.4989,-0.0008,-0.16%,40191120.00,United Kingdom,,11412,Utilities,Electric Utilities: Central
RNXT,RenovoRx Inc. Common Stock,$1.25,-0.03,-2.344%,29939781.00,United States,2021,13075,Health Care,Biotechnology: Pharmaceutical Preparations
ROAD,Construction Partners Inc. Class A Common Stock,$61.01,2.25,3.829%,3222997600.00,United States,2018,330174,Industrials,Military/Government/Technical
ROCK,Gibraltar Industries Inc. Common Stock,$79.49,5.14,6.913%,2422038758.00,United States,1993,216797,Industrials,Steel/Iron Ore
ROCL,Roth CH Acquisition V Co. Common Stock,$11.03,0.01,0.091%,0.00,United States,2022,260,Finance,Blank Checks
ROCLU,Roth CH Acquisition V Co. Unit,$11.00,-0.06,-0.542%,0.00,United States,2021,1601,Finance,Blank Checks
ROCLW,Roth CH Acquisition V Co. Warrant,$0.05,0.00,0.00%,0.00,United States,2022,1000,Finance,Blank Checks
ROIC,Retail Opportunity Investments Corp. Common Stock (MD),$13.33,0.17,1.292%,1698966539.00,United States,,751172,Real Estate,Real Estate Investment Trusts
ROIV,Roivant Sciences Ltd. Common Shares,$11.61,0.11,0.957%,8576560179.00,United Kingdom,,5669488,Health Care,Biotechnology: Pharmaceutical Preparations
ROKU,Roku Inc. Class A Common Stock,$64.73,2.29,3.668%,9331778830.00,United States,2017,4016031,Telecommunications,Cable & Other Pay Television Services
ROMA,Roma Green Finance Limited Ordinary Shares,$0.5899,-0.0121,-2.01%,6149879.00,Hong Kong,2024,59620,Consumer Discretionary,Professional Services
ROOT,Root Inc. Class A Common Stock,$80.97,4.86,6.385%,1206453000.00,United States,2020,382851,Finance,Property-Casualty Insurers
ROP,Roper Technologies Inc. Common Stock,$567.07,7.92,1.416%,60701742761.00,United States,1992,405658,Industrials,Industrial Machinery/Components
ROST,Ross Stores Inc. Common Stock,$148.87,0.79,0.533%,49659296256.00,United States,1985,2026381,Consumer Discretionary,Clothing/Shoe/Accessory Stores
RPAY,Repay Holdings Corporation Class A Common Stock,$9.82,0.23,2.398%,940618923.00,United States,2018,602409,Consumer Discretionary,Business Services
RPD,Rapid7 Inc. Common Stock,$41.26,1.04,2.586%,2571510809.00,United States,2015,603473,Technology,Computer Software: Prepackaged Software
RPHM,Reneo Pharmaceuticals Inc. Common Stock,$1.52,0.00,0.00%,50799628.00,United States,2021,16444,Health Care,Biotechnology: Pharmaceutical Preparations
RPID,Rapid Micro Biosystems Inc. Class A Common Stock,$0.6904,0.0384,5.89%,29591798.00,United States,2021,15663,Industrials,Biotechnology: Laboratory Analytical Instruments
RPRX,Royalty Pharma plc Class A Ordinary Shares ,$27.69,1.04,3.902%,16543038034.00,United States,2020,2869467,Health Care,Biotechnology: Pharmaceutical Preparations
RPTX,Repare Therapeutics Inc. Common Shares,$3.85,0.25,6.944%,163414813.00,Canada,2020,234844,Health Care,Biotechnology: Pharmaceutical Preparations
RR,Richtech Robotics Inc. Class B Common Stock,$1.19,0.05,4.386%,0.00,United States,2023,196128,Industrials,Industrial Machinery/Components
RRBI,Red River Bancshares Inc. Common Stock,$52.66,1.59,3.113%,363519774.00,United States,2019,33285,Consumer Discretionary,Hotels/Resorts
RRGB,Red Robin Gourmet Burgers Inc. Common Stock,$6.36,0.44,7.432%,99623040.00,United States,2002,544343,Consumer Discretionary,Restaurants
RRR,Red Rock Resorts Inc. Class A Common Stock,$61.24,1.46,2.442%,6466711104.00,United States,2016,652082,Consumer Discretionary,Hotels/Resorts
RSLS,ReShape Lifesciences Inc. Common Stock,$0.2341,0.0064,2.811%,5491305.00,United States,2016,977102,Health Care,Medical/Dental Instruments
RSSS,Research Solutions Inc Common Stock,$2.58,-0.05,-1.901%,83287661.00,United States,,19239,Consumer Discretionary,Business Services
RSVR,Reservoir Media Inc. Common Stock,$8.08,0.27,3.457%,524392113.00,United States,2021,70538,Consumer Discretionary,Services-Misc. Amusement & Recreation
RSVRW,Reservoir Media Inc. Warrant,$0.88,-0.06,-6.383%,57112012.00,United States,2021,1799,Consumer Discretionary,Services-Misc. Amusement & Recreation
RTC,Baijiayun Group Ltd. Class A Ordinary Shares,$6.0746,0.3146,5.462%,106539633.00,China,2006,34639,Technology,Computer Software: Prepackaged Software
RUM,Rumble Inc. Class A Common Stock,$7.11,-0.06,-0.837%,2757770318.00,United States,2021,3712547,Technology,Computer Software: Programming Data Processing
RUMBW,Rumble Inc. Warrant,$1.4302,0.0002,0.014%,554734614.00,United States,2021,9380,Technology,Computer Software: Programming Data Processing
RUN,Sunrun Inc. Common Stock,$17.28,1.62,10.345%,3830335085.00,United States,2015,15947877,Miscellaneous,Industrial Machinery/Components
RUSHA,Rush Enterprises Inc. Common Stock Cl A,$49.70,3.03,6.492%,3907123653.00,United States,,611603,Consumer Discretionary,Retail-Auto Dealers and Gas Stations
RUSHB,Rush Enterprises Inc. Class B,$46.03,2.56,5.889%,3618609693.00,United States,,29672,Consumer Discretionary,Retail-Auto Dealers and Gas Stations
RVMD,Revolution Medicines Inc. Common Stock,$46.77,0.77,1.674%,7716405837.00,United States,2020,2816548,Health Care,Biotechnology: Biological Products (No Diagnostic Substances)
RVMDW,Revolution Medicines Inc. Warrant,$0.24,0.00,0.00%,39596694.00,United States,,64,,
RVNC,Revance Therapeutics Inc. Common Stock,$4.25,0.44,11.549%,443906134.00,United States,2014,2514790,Health Care,Biotechnology: Pharmaceutical Preparations
RVPH,Reviva Pharmaceuticals Holdings Inc. Common Stock ,$1.20,-0.02,-1.639%,33502272.00,United States,2020,226827,Health Care,Biotechnology: Pharmaceutical Preparations
RVPHW,Reviva Pharmaceuticals Holdings Inc. Warrants,$0.20,-0.021,-9.502%,5583712.00,United States,2018,10173,Health Care,Biotechnology: Pharmaceutical Preparations
RVSB,Riverview Bancorp Inc Common Stock,$4.20,0.12,2.941%,88666381.00,United States,,37828,Finance,Savings Institutions
RVSN,Rail Vision Ltd. Ordinary Share,$0.7899,-0.0071,-0.891%,2368340.00,Israel,2022,247221,Industrials,Railroads
RVYL,Ryvyl Inc. Common Stock,$2.04,-0.01,-0.488%,13197458.00,United States,,19439,Consumer Discretionary,Professional Services
RWAY,Runway Growth Finance Corp. Common Stock,$11.85,-0.04,-0.336%,467345751.00,United States,2021,155194,Finance,Finance: Consumer Services
RWAYL,Runway Growth Finance Corp. 7.50% Notes due 2027,$25.1737,0.1037,0.414%,992811961.00,United States,,9138,Finance,Finance: Consumer Services
RWAYZ,Runway Growth Finance Corp. 8.00% Notes due 2027,$25.23,0.08,0.318%,995032346.00,United States,,6050,Finance,Finance: Consumer Services
RXRX,Recursion Pharmaceuticals Inc. Class A Common Stock,$8.60,0.40,4.878%,2043907545.00,United States,2021,4957427,Health Care,Biotechnology: Biological Products (No Diagnostic Substances)
RXST,RxSight Inc. Common Stock,$49.43,0.79,1.624%,1838615037.00,United States,2021,766049,Health Care,Ophthalmic Goods
RXT,Rackspace Technology Inc. Common Stock,$2.575,0.125,5.102%,576415159.00,United States,2020,1695521,Technology,Computer Software: Programming Data Processing
RYAAY,Ryanair Holdings plc American Depositary Shares,$120.44,1.89,1.594%,137278779992.00,Ireland,1997,578324,Consumer Discretionary,Air Freight/Delivery Services
RYTM,Rhythm Pharmaceuticals Inc. Common Stock,$53.89,1.99,3.834%,3285830066.00,United States,2017,1054047,Health Care,Biotechnology: Pharmaceutical Preparations
RZLT,Rezolute Inc. Common Stock (NV),$4.78,-0.07,-1.443%,191846003.00,United States,,256821,Health Care,Biotechnology: Pharmaceutical Preparations
SABR,Sabre Corporation Common Stock,$3.40,0.27,8.626%,1298570041.00,United States,2014,4818645,Technology,Computer Software: Programming Data Processing
