Symbol,Name,Last Sale,Net Change,% Change,Market Cap,Country,IPO Year,Volume,Sector,Industry
INTA,Intapp Inc. Common Stock,$36.00,0.63,1.781%,2643498792.00,United States,2021,578622,Technology,Computer Software: Prepackaged Software
INTC,Intel Corporation Common Stock,$34.34,-0.12,-0.348%,146185380000.00,United States,,28116169,Technology,Semiconductors
INTE,Integral Acquisition Corporation 1 Class A Common Stock,$11.02,0.01,0.091%,0.00,United States,2021,3027,Finance,Blank Checks
INTG,Intergroup Corporation (The) Common Stock,$22.11,0.01,0.045%,48359302.00,United States,,412,Real Estate,Building operators
INTJ,Intelligent Group Limited Ordinary Shares,$1.00,0.0079,0.796%,13125000.00,Hong Kong,2024,23834,Consumer Discretionary,Professional Services
INTR,Inter & Co. Inc. Class A Common Shares,$6.88,-0.07,-1.007%,3019215058.00,Brazil,,942043,Finance,Commercial Banks
INTS,Intensity Therapeutics Inc. Common stock,$4.92,0.03,0.613%,67462435.00,United States,2023,10379,Health Care,Biotechnology: Biological Products (No Diagnostic Substances)
INTU,Intuit Inc. Common Stock,$666.15,7.97,1.211%,186220234050.00,United States,1993,988437,Technology,Computer Software: Prepackaged Software
INTZ,Intrusion Inc. Common Stock,$1.29,0.04,3.20%,6326412.00,United States,,196144,Telecommunications,Computer Communications Equipment
INVA,Innoviva Inc. Common Stock,$17.15,0.30,1.78%,1070927943.00,United States,2004,414651,Health Care,Biotechnology: Pharmaceutical Preparations
INVE,Identiv Inc. Common Stock,$4.29,0.03,0.704%,100310749.00,United States,,73835,Technology,Computer peripheral equipment
INVO,INVO BioScience Inc. Common Stock,$0.81,-0.0008,-0.099%,3085089.00,United States,,92180,Health Care,Medical/Dental Instruments
INVZ,Innoviz Technologies Ltd. Ordinary shares,$0.9925,0.0975,10.894%,164146695.00,Israel,,4352455,Consumer Discretionary,Auto Parts:O.E.M.
INVZW,Innoviz Technologies Ltd. Warrant,$0.21,0.00,0.00%,34731291.00,Israel,,93,Consumer Discretionary,Auto Parts:O.E.M.
INZY,Inozyme Pharma Inc. Common Stock,$5.77,0.31,5.678%,356906287.00,United States,2020,435067,Health Care,Biotechnology: Pharmaceutical Preparations
IOBT,IO Biotech Inc. Common Stock,$1.33,-0.05,-3.623%,87621616.00,Denmark,2021,106335,Health Care,Biotechnology: Pharmaceutical Preparations
IONM,Assure Holdings Corp. Common Stock,$4.43,0.43,10.75%,2609345.00,United States,,35370,Health Care,Medical/Dental Instruments
IONR,ioneer Ltd American Depositary Shares,$4.06,0.19,4.91%,213030055.00,Australia,,25415,Industrials,Mining & Quarrying of Nonmetallic Minerals (No Fuels)
IONS,Ionis Pharmaceuticals Inc. Common Stock,$49.84,2.27,4.772%,7274914240.00,United States,,1962970,Health Care,Biotechnology: Pharmaceutical Preparations
IOSP,Innospec Inc. Common Stock,$130.25,4.74,3.777%,3247555161.00,United States,,227201,Industrials,Major Chemicals
IOVA,Iovance Biotherapeutics Inc. Common Stock,$9.41,0.73,8.41%,2633225914.00,United States,,8596690,Health Care,Biotechnology: Biological Products (No Diagnostic Substances)
IPA,ImmunoPrecise Antibodies Ltd. Common Stock,$0.98,0.003,0.307%,25788955.00,Canada,,50502,Health Care,Biotechnology: Pharmaceutical Preparations
IPAR,Inter Parfums Inc. Common Stock,$127.08,2.06,1.648%,4069564171.00,United States,,176633,Consumer Discretionary,Package Goods/Cosmetics
IPDN,Professional Diversity Network Inc. Common Stock,$0.49,0.009,1.871%,5721678.00,United States,2013,22345,Technology,Computer Software: Programming Data Processing
IPGP,IPG Photonics Corporation Common Stock,$90.65,1.27,1.421%,4130757058.00,United States,2006,592162,Technology,Semiconductors
IPHA,Innate Pharma S.A. ADS,$2.15,0.03,1.415%,172974556.00,France,2019,3105,Health Care,Biotechnology: Biological Products (No Diagnostic Substances)
IPSC,Century Therapeutics Inc. Common Stock,$3.29,0.54,19.636%,272567864.00,United States,2021,386959,Health Care,Biotechnology: Biological Products (No Diagnostic Substances)
IPW,iPower Inc. Common Stock,$1.97,0.14,7.65%,58741917.00,United States,2021,426233,Consumer Discretionary,RETAIL: Building Materials
IPWR,Ideal Power Inc. Common Stock,$7.9406,-0.0294,-0.369%,61017460.00,United States,2013,16143,Technology,Semiconductors
IPX,IperionX Limited American Depositary Share,$15.71,-0.02,-0.127%,303979027.00,United States,,14472,Basic Materials,Other Metals and Minerals
IPXX,Inflection Point Acquisition Corp. II Class A Ordinary Share,$10.62,0.01,0.094%,0.00,United States,2023,113365,Finance,Blank Checks
IPXXU,Inflection Point Acquisition Corp. II Unit,$10.65,0.01,0.094%,0.00,United States,2023,100,Finance,Blank Checks
IQ,iQIYI Inc. American Depositary Shares,$3.75,-0.04,-1.055%,3597930581.00,China,2018,6937822,Consumer Discretionary,Consumer Electronics/Video Chains
IRAA,Iris Acquisition Corp Class A Common Stock,$11.61,0.43,3.846%,0.00,United States,2021,1101,Finance,Blank Checks
IRAAU,Iris Acquisition Corp Units,$11.97,0.58,5.092%,0.00,United States,2021,802,Finance,Blank Checks
IRBT,iRobot Corporation Common Stock,$11.52,0.84,7.865%,331283566.00,United States,2005,1499126,Consumer Discretionary,Consumer Electronics/Appliances
IRDM,Iridium Communications Inc Common Stock,$26.39,0.60,2.326%,3204498616.00,United States,,786719,Telecommunications,Telecommunications Equipment
IREN,Iris Energy Limited Ordinary Shares,$12.34,0.345,2.876%,827895178.00,Australia,2021,29526127,Technology,EDP Services
IRIX,IRIDEX Corporation Common Stock,$2.13,0.01,0.472%,34618779.00,United States,1996,38752,Health Care,Biotechnology: Electromedical & Electrotherapeutic Apparatus
IRMD,iRadimed Corporation Common Stock,$46.80,0.84,1.828%,592683858.00,United States,2014,58036,Health Care,Medical/Dental Instruments
IROH,Iron Horse Acquisitions Corp. Common Stock,$10.09,0.00,0.00%,0.00,United States,2024,62,,
IROHU,Iron Horse Acquisitions Corp. Unit,$10.30,0.00,0.00%,0.00,United States,2023,100,,
IRON,Disc Medicine Inc. Common Stock,$47.92,-1.31,-2.661%,1184662235.00,United States,,269418,Health Care,Biotechnology: Pharmaceutical Preparations
IROQ,IF Bancorp Inc. Common Stock,$16.75,0.20,1.208%,56163186.00,United States,2011,801,Finance,Savings Institutions
IRTC,iRhythm Technologies Inc. Common Stock,$104.96,6.36,6.45%,3264768520.00,United States,2016,420937,Health Care,Medical/Dental Instruments
IRWD,Ironwood Pharmaceuticals Inc. Class A Common Stock,$6.88,0.40,6.173%,1093625006.00,United States,2010,1975300,Health Care,Biotechnology: Pharmaceutical Preparations
ISPC,iSpecimen Inc. Common Stock,$0.3055,0.0209,7.344%,3048572.00,United States,2021,7593483,Health Care,Biotechnology: Commercial Physical & Biological Resarch
ISPO,Inspirato Incorporated Class A Common Stock,$3.45,-0.15,-4.167%,11505233.00,United States,2021,5610,Finance,Blank Checks
ISPOW,Inspirato Incorporated Warrant,$0.0128,0.0028,28.00%,0.00,United States,2021,22525,Finance,Blank Checks
ISPR,Ispire Technology Inc. Common Stock,$7.65,-0.21,-2.672%,431464865.00,United States,2023,66190,Health Care, Medicinal Chemicals and Botanical Products 
ISRG,Intuitive Surgical Inc. Common Stock,$438.01,0.76,0.174%,155364697094.00,United States,2000,1435236,Health Care,Industrial Specialties
ISRL,Israel Acquisitions Corp Class A Ordinary Shares,$11.02,-0.005,-0.045%,0.00,United States,2023,93809,Finance,Blank Checks
ISRLW,Israel Acquisitions Corp Warrant,$0.0698,0.0098,16.333%,0.00,United States,2023,6002,Finance,Blank Checks
ISSC,Innovative Solutions and Support Inc. Common Stock,$5.65,-0.11,-1.91%,98839433.00,United States,2000,33344,Technology,EDP Services
ISTR,Investar Holding Corporation Common Stock,$17.71,0.76,4.484%,174075079.00,United States,2014,115855,Finance,Major Banks
ITCI,Intra-Cellular Therapies Inc. Common Stock,$78.57,-0.12,-0.152%,8295016357.00,United States,,608948,Health Care,Biotechnology: Pharmaceutical Preparations
ITI,Iteris Inc. Common Stock,$4.89,0.25,5.388%,210148836.00,United States,,159622,Telecommunications,Telecommunications Equipment
ITIC,Investors Title Company Common Stock,$192.10,6.05,3.252%,361889506.00,United States,,50646,Finance,Specialty Insurers
ITOS,iTeos Therapeutics Inc. Common Stock,$17.56,0.97,5.847%,634318510.00,United States,2020,351452,Health Care,Biotechnology: Biological Products (No Diagnostic Substances)
ITRI,Itron Inc. Common Stock,$107.43,2.25,2.139%,4927746741.00,United States,1993,963688,Industrials,Electrical Products
ITRM,Iterum Therapeutics plc Ordinary Share,$1.345,-0.235,-14.873%,22266320.00,Ireland,2018,599890,Health Care,Biotechnology: Pharmaceutical Preparations
ITRN,Ituran Location and Control Ltd. Ordinary Shares,$25.65,0.48,1.907%,510270327.00,Israel,2005,125701,Technology,Electronic Components
IVA,Inventiva S.A. American Depository Shares,$2.60,-0.0678,-2.541%,135501098.00,France,2020,17174,Health Care,Biotechnology: Pharmaceutical Preparations
IVAC,Intevac Inc. Common Stock,$4.06,0.08,2.01%,107931271.00,United States,1995,92829,Technology,Industrial Machinery/Components
IVCA,Investcorp India Acquisition Corp. Class A Ordinary Share,$11.35,0.00,0.00%,0.00,Cayman Islands,2022,105,Finance,Blank Checks
IVCB,Investcorp Europe Acquisition Corp I Class A Ordinary Shares,$11.36,0.00,0.00%,0.00,Cayman Islands,2022,22605,Finance,Blank Checks
IVCBW,Investcorp Europe Acquisition Corp I Warrant,$0.036,-0.0014,-3.743%,0.00,Cayman Islands,2022,913,Finance,Blank Checks
IVCP,Swiftmerge Acquisition Corp. Class A Ordinary Share,$10.99,0.00,0.00%,309093750.00,United States,2022,2,Finance,Blank Checks
IVCPW,Swiftmerge Acquisition Corp. Warrants,$0.09,-0.0176,-16.357%,0.00,United States,2022,169600,Finance,Blank Checks
IVDA,Iveda Solutions Inc. Common Stock,$0.4672,-0.0326,-6.523%,7601293.00,United States,,58374,Technology,Computer Software: Prepackaged Software
IVDAW,Iveda Solutions Inc. Warrant,$0.0708,0.00,0.00%,1151908.00,United States,,112,Technology,Computer Software: Prepackaged Software
IVP,Inspire Veterinary Partners Inc. Class A Common Stock,$10.28,-1.00,-8.865%,9848785.00,United States,2023,1409082,Consumer Staples,Farming/Seeds/Milling
IVVD,Invivyd Inc. Common Stock,$1.39,0.10,7.752%,165848944.00,United States,2021,573769,Health Care,Biotechnology: Biological Products (No Diagnostic Substances)
IXAQ,IX Acquisition Corp. Class A Ordinary Share,$11.41,0.03,0.264%,0.00,United Kingdom,2021,49882,Finance,Blank Checks
IXHL,Incannex Healthcare Inc. Common Stock,$2.55,-0.14,-5.204%,40476438.00,Australia,,19820,Health Care,Biotechnology: Pharmaceutical Preparations
IZEA,IZEA Worldwide Inc. Common Stock,$2.57,0.20,8.439%,41993440.00,United States,,64445,Consumer Discretionary,Advertising
IZM,ICZOOM Group Inc. Class A Ordinary Shares,$2.14,0.02,0.943%,22192138.00,China,2023,72266,Consumer Discretionary,Consumer Electronics/Video Chains
JACK,Jack In The Box Inc. Common Stock,$54.81,3.17,6.139%,1062770011.00,United States,,549954,Consumer Discretionary,Restaurants
JAGX,Jaguar Health Inc. Common Stock,$4.17,0.12,2.963%,20388072.00,United States,2015,329449,Health Care,Biotechnology: Pharmaceutical Preparations
JAKK,JAKKS Pacific Inc. Common Stock,$19.56,0.97,5.218%,211265448.00,United States,1996,125401,Consumer Discretionary,Recreational Games/Products/Toys
JAMF,Jamf Holding Corp. Common Stock,$18.68,0.49,2.694%,2399515527.00,United States,2020,355917,Technology,Computer Software: Prepackaged Software
JANX,Janux Therapeutics Inc. Common Stock,$46.38,2.91,6.694%,2404833935.00,United States,2021,856227,Health Care,Biotechnology: Pharmaceutical Preparations
JAZZ,Jazz Pharmaceuticals plc Common Stock (Ireland),$106.09,2.76,2.671%,6687873074.00,Ireland,2007,499092,Health Care,Biotechnology: Pharmaceutical Preparations
JBHT,J.B. Hunt Transport Services Inc. Common Stock,$176.00,6.38,3.761%,18162596848.00,United States,,1966914,Industrials,Trucking Freight/Courier Services
JBLU,JetBlue Airways Corporation Common Stock,$6.54,0.31,4.976%,2224483227.00,United States,2002,14470217,Consumer Discretionary,Air Freight/Delivery Services
JBSS,John B. Sanfilippo & Son Inc. Common Stock,$96.49,0.79,0.825%,1119618241.00,United States,1991,131150,Consumer Staples,Specialty Foods
JCSE,JE Cleantech Holdings Limited Ordinary Shares,$0.73,0.03,4.286%,3654866.00,Singapore,2022,8797,Consumer Discretionary,Miscellaneous manufacturing industries
JCTCF,Jewett-Cameron Trading Company Common Shares,$4.89,-0.03,-0.61%,17138482.00,United States,,19861,Consumer Discretionary,RETAIL: Building Materials
JD,JD.com Inc. American Depositary Shares,$27.20,0.55,2.064%,42761611885.00,China,2014,7462410,Consumer Discretionary,Other Specialty Stores
JDZG,JIADE LIMITED Common stock,$0.851,0.002,0.236%,20624386.00,China,2024,173340,Real Estate,Other Consumer Services
JEWL,Adamas One Corp. Common Stock,$0.33,-0.1152,-25.876%,9238009.00,United States,2022,255050,Consumer Discretionary,Consumer Specialties
JFBR,Jeffs' Brands Ltd Ordinary Shares,$0.324,-0.0109,-3.255%,393826.00,Israel,2022,385246,Consumer Discretionary,Other Specialty Stores
JFBRW,Jeffs' Brands Ltd Warrant,$0.0269,0.00,0.00%,32697.00,Israel,2022,47,Consumer Discretionary,Other Specialty Stores
JFIN,Jiayin Group Inc. American Depositary Shares,$6.23,-0.18,-2.808%,330392388.00,China,2019,36426,Finance,Finance: Consumer Services
JFU,9F Inc. American Depositary Shares,$2.015,-0.063,-3.032%,23723266.00,China,2019,6657,Finance,Finance: Consumer Services
JG,Aurora Mobile Limited American Depositary Shares,$2.5699,-0.0001,-0.004%,15369313.00,China,2018,1271,Technology,Computer Software: Programming Data Processing
JJSF,J & J Snack Foods Corp. Common Stock,$165.50,1.14,0.694%,3208418583.00,United States,1986,123699,Consumer Staples,Specialty Foods
JKHY,Jack Henry & Associates Inc. Common Stock,$169.74,2.37,1.416%,12374050413.00,United States,1985,345170,Technology,EDP Services
JL,J-Long Group Limited Ordinary Shares,$0.5192,0.0257,5.208%,16302880.00,Hong Kong,2024,109776,Consumer Discretionary,Clothing/Shoe/Accessory Stores
JMSB,John Marshall Bancorp Inc. Common Stock,$19.64,0.21,1.081%,279302522.00,United States,,42112,Finance,Major Banks
JNVR,Janover Inc. Common Stock,$0.7755,0.0008,0.103%,8580579.00,United States,2023,102562,Finance,Finance: Consumer Services
JOUT,Johnson Outdoors Inc. Class A Common Stock,$37.70,1.23,3.373%,388360593.00,United States,,74846,Consumer Discretionary,Recreational Games/Products/Toys
JRSH,Jerash Holdings (US) Inc. Common Stock,$2.995,0.015,0.503%,36823046.00,United States,2018,58254,Consumer Discretionary,Apparel
JRVR,James River Group Holdings Ltd. Common Shares,$8.47,0.16,1.925%,320384246.00,Bermuda,2014,501714,Finance,Property-Casualty Insurers
JSM,Navient Corporation 6% Senior Notes due December 15 2043,$19.4899,0.1798,0.931%,2179453176.00,United States,,7019,Finance,Finance: Consumer Services
JSPR,Jasper Therapeutics Inc. Common Stock,$21.60,1.68,8.434%,325847945.00,United States,2020,372995,Health Care,Biotechnology: Biological Products (No Diagnostic Substances)
JSPRW,Japer Therapeutics Inc. Warrants,$0.2113,0.0014,0.667%,3187577.00,United States,2020,25676,Health Care,Biotechnology: Biological Products (No Diagnostic Substances)
JTAI,Jet.AI Inc. Common Stock,$0.3539,0.0137,4.027%,4514045.00,Cayman Islands,2021,146084,Consumer Discretionary,Transportation Services
JTAIW,Jet.AI Inc. Warrant,$0.0783,0.00,0.00%,998728.00,Cayman Islands,2021,6300,Consumer Discretionary,Transportation Services
JTAIZ,Jet.AI Inc. Merger Consideration Warrants,$0.33,-0.02,-5.714%,4209198.00,Cayman Islands,,3633,Consumer Discretionary,Transportation Services
JUNE,Junee Limited Ordinary Shares,$4.9001,-0.4099,-7.719%,62301273.00,Hong Kong,2024,192227,,
JVA,Coffee Holding Co. Inc. Common Stock,$2.14,0.00,0.00%,12216402.00,United States,2005,25768,Consumer Staples,Packaged Foods
JVSA,JV SPAC Acquisition Corp. Class A Ordinary Share,$10.16,0.01,0.099%,0.00,China,2024,11077,,
JVSAU,JVSPAC Acquisition Corp. Unit,$10.44,0.00,0.00%,0.00,China,2024,41,,
JWEL,Jowell Global Ltd. Ordinary Shares,$2.05,0.0642,3.233%,4449474.00,China,2021,2085,Consumer Discretionary,Other Consumer Services
JXJT,JX Luxventure Limited Common Stock,$1.2599,0.0199,1.605%,7639016.00,China,2013,39776,Consumer Staples,Apparel
JYD,Jayud Global Logistics Limited Class A Ordinary Shares,$0.6382,0.0336,5.557%,13626989.00,China,2023,21945,Consumer Discretionary,Oil Refining/Marketing
JYNT,The Joint Corp. Common Stock,$15.06,0.81,5.684%,225507085.00,United States,2014,58758,Miscellaneous,Multi-Sector Companies
JZ,Jianzhi Education Technology Group Company Limited American Depositary Shs,$0.92,-0.0401,-4.177%,18570200.00,China,2022,2239,Real Estate,Other Consumer Services
JZXN,Jiuzi Holdings Inc. Ordinary Shares,$3.075,0.185,6.401%,27841044.00,China,2021,200270,Consumer Discretionary,Retail-Auto Dealers and Gas Stations
KA,Kineta Inc. Common Stock,$0.73,0.0099,1.375%,8945752.00,United States,2016,110768,Health Care,Biotechnology: Pharmaceutical Preparations
KACL,Kairous Acquisition Corp. Limited Ordinary Shares,$12.05,0.00,0.00%,0.00,Malaysia,2022,82,Finance,Blank Checks
KALA,KALA BIO Inc. Common Stock,$7.82,0.27,3.576%,22024670.00,United States,2017,34515,Health Care,Biotechnology: Pharmaceutical Preparations
KALU,Kaiser Aluminum Corporation Common Stock,$99.35,3.97,4.162%,1596438559.00,United States,,140466,Industrials,Metal Fabrications
KALV,KalVista Pharmaceuticals Inc. Common Stock,$15.25,0.29,1.939%,651718617.00,United Kingdom,2015,803512,Health Care,Biotechnology: Pharmaceutical Preparations
KARO,Karooooo Ltd. Ordinary Shares,$33.09,1.13,3.536%,1022481000.00,Singapore,2021,13546,Technology,Computer Software: Prepackaged Software
KAVL,Kaival Brands Innovations Group Inc. Common Stock,$1.31,-0.01,-0.758%,3750533.00,United States,,517331,Consumer Discretionary,Other Consumer Services
KC,Kingsoft Cloud Holdings Limited American Depositary Shares,$2.75,0.05,1.852%,697635546.00,China,2020,520849,Technology,Computer Software: Prepackaged Software
KDLY,Kindly MD Inc. Common Stock,$2.37,0.02,0.851%,14076653.00,United States,2024,6883,Health Care,Medical/Nursing Services
KDLYW,Kindly MD Inc. Warrants,$0.3497,-0.0503,-12.575%,2077049.00,United States,2024,200,Health Care,Medical/Nursing Services
KDP,Keurig Dr Pepper Inc. Common Stock,$32.66,-0.01,-0.031%,44273055822.00,United States,,7813576,Consumer Staples,Beverages (Production/Distribution)
KE,Kimball Electronics Inc. Common Stock,$24.28,1.36,5.934%,603824322.00,United States,,129248,Technology,Electrical Products
KELYA,Kelly Services Inc. Class A Common Stock,$22.33,1.00,4.688%,793199985.00,United States,,608377,Consumer Discretionary,Professional Services
KELYB,Kelly Services Inc. Class B Common Stock,$20.60,0.00,0.00%,731747411.00,United States,,63,Consumer Discretionary,Professional Services
KEQU,Kewaunee Scientific Corporation Common Stock,$51.97,-0.03,-0.058%,147602232.00,United States,,15157,Industrials,Medical Specialities
KFFB,Kentucky First Federal Bancorp Common Stock,$3.32,-0.06,-1.775%,26887734.00,United States,2005,1578,Finance,Savings Institutions
KGEI,Kolibri Global Energy Inc. Common stock,$3.46,0.06,1.765%,123264531.00,United States,,8966,Energy,Oil & Gas Production
KHC,The Kraft Heinz Company Common Stock,$32.84,0.55,1.703%,39877552297.00,United States,,6192849,Consumer Staples,Packaged Foods
KIDS,OrthoPediatrics Corp. Common Stock,$35.36,2.48,7.543%,842589268.00,United States,2017,374829,Health Care,Medical/Dental Instruments
KINS,Kingstone Companies Inc. Common Stock,$4.85,0.07,1.464%,53388975.00,United States,,33269,Finance,Property-Casualty Insurers
KIRK,Kirkland's Inc. COMMONSTOCK,$1.76,0.03,1.734%,22948601.00,United States,2002,99361,Consumer Discretionary,Other Specialty Stores
KITT,Nauticus Robotics Inc. Common stock,$0.1304,0.0006,0.462%,8141103.00,United States,2021,2784744,Industrials,Industrial Machinery/Components
KITTW,Nauticus Robotics Inc. Warrant,$0.0228,0.00,0.00%,1423444.00,United States,2021,24643,Industrials,Industrial Machinery/Components
KLAC,KLA Corporation Common Stock,$867.18,9.06,1.056%,116757072708.00,United States,1980,627354,Technology,Electronic Components
KLIC,Kulicke and Soffa Industries Inc. Common Stock,$53.24,1.18,2.267%,2952886430.00,Singapore,,411907,Technology,Semiconductors
KLTR,Kaltura Inc. Common Stock,$1.20,0.00,0.00%,176293422.00,United States,2021,444866,Technology,Computer Software: Prepackaged Software
KLXE,KLX Energy Services Holdings Inc. Common Stock,$5.53,0.17,3.172%,93275854.00,United States,,174456,Energy,Oilfield Services/Equipment
KMDA,Kamada Ltd. Ordinary Shares,$5.82,0.04,0.692%,260968800.00,Israel,2013,28265,Health Care,Biotechnology: Pharmaceutical Preparations
KNDI,Kandi Technologies Group Inc. Ordinary Shares,$1.99,0.05,2.577%,173842886.00,China,,62735,Consumer Discretionary,Auto Manufacturing
KNSA,Kiniksa Pharmaceuticals International plc Class A Ordinary Shares,$22.35,0.74,3.424%,1585512241.00,United States,2018,388904,Health Care,Biotechnology: Pharmaceutical Preparations
KOD,Kodiak Sciences Inc Common Stock,$3.24,0.28,9.459%,170213228.00,United States,2018,501486,Health Care,Biotechnology: Biological Products (No Diagnostic Substances)
KOPN,Kopin Corporation Common Stock,$1.19,0.11,10.185%,140929320.00,United States,1992,1301975,Technology,Semiconductors
KOSS,Koss Corporation Common Stock,$10.18,1.46,16.743%,94213813.00,United States,,13926164,Consumer Staples,Consumer Electronics/Appliances
KPLT,Katapult Holdings Inc. Common Stock,$19.04,0.16,0.847%,78171481.00,United States,2019,32123,Consumer Discretionary,Diversified Commercial Services
KPLTW,Katapult Holdings Inc. Warrant,$0.014,-0.0015,-9.677%,57479.00,United States,2019,1803,Consumer Discretionary,Diversified Commercial Services
KPRX,Kiora Pharmaceuticals Inc.  Common Stock,$4.29,0.1699,4.124%,12743737.00,United States,,22586,Health Care,Biotechnology: Pharmaceutical Preparations
KPTI,Karyopharm Therapeutics Inc. Common Stock,$1.00,0.0316,3.263%,117710263.00,United States,2013,1676899,Health Care,Biotechnology: Pharmaceutical Preparations
KRKR,36Kr Holdings Inc. American Depositary Shares,$0.2928,-0.0044,-1.48%,11420870.00,China,2019,6843554,Consumer Discretionary,Business Services
KRMD,KORU Medical Systems Inc. Common Stock (DE),$2.68,0.18,7.20%,122648123.00,United States,,20652,Health Care,Medical/Dental Instruments
KRNL,Kernel Group Holdings Inc. Class A Ordinary Shares,$11.02,0.00,0.00%,0.00,United States,2021,1765,Finance,Blank Checks
KRNT,Kornit Digital Ltd. Ordinary Shares,$16.21,0.34,2.142%,773535251.00,Israel,2015,218365,Industrials,Industrial Machinery/Components
KRNY,Kearny Financial Corp Common Stock,$6.88,0.36,5.521%,443326526.00,United States,2005,702397,Finance,Savings Institutions
KRON,Kronos Bio Inc. Common Stock,$1.50,0.06,4.167%,90141614.00,United States,2020,577023,Health Care,Biotechnology: Pharmaceutical Preparations
KROS,Keros Therapeutics Inc. Common Stock,$52.17,1.14,2.234%,1882496333.00,United States,2020,522743,Health Care,Biotechnology: Pharmaceutical Preparations
KRRO,Korro Bio Inc. Common Stock,$52.35,3.10,6.294%,485440869.00,United States,2019,63464,Health Care,Biotechnology: Pharmaceutical Preparations
KRT,Karat Packaging Inc. Common Stock,$30.35,0.89,3.021%,606242221.00,United States,2021,82183,Industrials,Plastic Products
KRUS,Kura Sushi USA Inc. Class A Common Stock,$57.60,4.48,8.434%,647708717.00,United States,2019,280814,Consumer Discretionary,Restaurants
KRYS,Krystal Biotech Inc. Common Stock,$208.55,0.67,0.322%,5955862662.00,United States,2017,342835,Health Care,Biotechnology: Biological Products (No Diagnostic Substances)
KSCP,Knightscope Inc. Class A Common Stock,$0.3034,0.0289,10.528%,32463477.00,United States,2022,8966768,Telecommunications,Telecommunications Equipment
KSPI,Joint Stock Company Kaspi.kz American Depository Shares,$138.655,4.225,3.143%,26252031590.00,Kazakhstan,2024,343347,,
KTCC,Key Tronic Corporation Common Stock,$3.90,0.10,2.632%,41971297.00,United States,1983,70153,Technology,Electrical Products
KTOS,Kratos Defense & Security Solutions Inc. Common Stock,$22.07,0.60,2.795%,3312666921.00,United States,,1021943,Industrials,Military/Government/Technical
KTRA,Kintara Therapeutics Inc. Common Stock,$0.286,0.0015,0.527%,15817119.00,United States,,2154430,Health Care,Biotechnology: Pharmaceutical Preparations
KTTA,Pasithea Therapeutics Corp. Common Stock,$5.925,-0.1351,-2.229%,6181244.00,United States,2021,4184,Health Care,Biotechnology: Pharmaceutical Preparations
KURA,Kura Oncology Inc. Common Stock,$23.23,0.46,2.02%,1769675803.00,United States,,722521,Health Care,Biotechnology: Pharmaceutical Preparations
KVAC,Keen Vision Acquisition Corporation Ordinary Shares,$10.62,0.00,0.00%,0.00,United States,2023,61380,,
KVACW,Keen Vision Acquisition Corporation Warrant,$0.085,0.025,41.667%,0.00,United States,2023,10600,,
KVHI,KVH Industries Inc. Common Stock,$4.56,0.02,0.441%,89905968.00,United States,1996,73919,Technology,Radio And Television Broadcasting And Communications Equipment
KWE,KWESST Micro Systems Inc. Common Stock,$0.40,0.06,17.647%,4430697.00,Canada,,2917500,Technology,Computer Software: Prepackaged Software
KWESW,KWESST Micro Systems Inc. Warrant,$0.0294,0.0044,17.60%,504464.00,Canada,,238,Technology,Computer Software: Prepackaged Software
KXIN,Kaixin Holdings Ordinary Shares,$0.1201,-0.0009,-0.744%,5981767.00,China,2017,665876,Consumer Discretionary,Retail-Auto Dealers and Gas Stations
KYMR,Kymera Therapeutics Inc. Common Stock,$48.49,3.49,7.756%,2975262124.00,United States,2020,1285017,Health Care,Biotechnology: Biological Products (No Diagnostic Substances)
KYTX,Kyverna Therapeutics Inc. Common Stock,$11.07,1.16,11.705%,477285751.00,United States,2024,926834,Health Care,Biotechnology: Biological Products (No Diagnostic Substances)
KZIA,Kazia Therapeutics Limited American Depositary Shares,$0.5723,0.0144,2.581%,13050106.00,Australia,,24825708,Health Care,Biotechnology: Pharmaceutical Preparations
