Symbol,Name,Last Sale,Net Change,% Change,Market Cap,Country,IPO Year,Volume,Sector,Industry
CRML,Critical Metals Corp. Ordinary Shares,$10.58,0.18,1.731%,863749941.00,British Virgin Islands,,20560,Basic Materials,Metal Mining
CRMLW,Critical Metals Corp. Warrants,$0.3287,0.0288,9.603%,26835029.00,British Virgin Islands,,20390,Basic Materials,Metal Mining
CRMT,America's Car-Mart Inc Common Stock,$70.15,1.87,2.739%,448405675.00,United States,,160462,Consumer Discretionary,Retail-Auto Dealers and Gas Stations
CRNC,Cerence Inc. Common Stock,$3.21,0.10,3.215%,134104947.00,United States,,968301,Technology,Computer Software: Prepackaged Software
CRNT,Ceragon Networks Ltd. Ordinary Shares,$2.70,0.08,3.053%,230629467.00,Israel,,374344,Technology,Radio And Television Broadcasting And Communications Equipment
CRNX,Crinetics Pharmaceuticals Inc. Common Stock,$54.98,0.84,1.552%,4335695860.00,United States,2018,1389013,Health Care,Biotechnology: Pharmaceutical Preparations
CRON,Cronos Group Inc. Common Share,$2.42,0.04,1.681%,924467051.00,Canada,,1067842,Health Care, Medicinal Chemicals and Botanical Products 
CROX,Crocs Inc. Common Stock,$136.10,0.25,0.184%,8261610250.00,United States,2006,1272801,Consumer Discretionary,Shoe Manufacturing
CRSP,CRISPR Therapeutics AG Common Shares,$62.75,5.29,9.206%,5328610336.00,Switzerland,2016,3076341,Health Care,Biotechnology: Biological Products (No Diagnostic Substances)
CRSR,Corsair Gaming Inc. Common Stock,$10.49,0.21,2.043%,1089969356.00,United States,2020,462583,Technology,Computer peripheral equipment
CRTO,Criteo S.A. American Depositary Shares,$40.17,0.02,0.05%,2277136754.00,France,2013,229714,Consumer Discretionary,Advertising
CRUS,Cirrus Logic Inc. Common Stock,$142.65,2.84,2.031%,7641605439.00,United States,1989,426284,Technology,Semiconductors
CRVL,CorVel Corp. Common Stock,$287.85,20.15,7.527%,4928503797.00,United States,,67601,Finance,Specialty Insurers
CRVO,CervoMed Inc. Common Stock,$19.77,1.76,9.772%,163176460.00,United States,,120188,Health Care,Biotechnology: Pharmaceutical Preparations
CRVS,Corvus Pharmaceuticals Inc. Common Stock,$2.33,0.33,16.50%,145744485.00,United States,2016,331761,Health Care,Biotechnology: Pharmaceutical Preparations
CRWD,CrowdStrike Holdings Inc. Class A Common Stock,$369.05,-8.32,-2.205%,89812243823.00,United States,2019,2604188,Technology,Computer Software: Prepackaged Software
CRWS,Crown Crafts Inc Common Stock,$4.92,0.12,2.50%,50728737.00,United States,,37164,Consumer Discretionary,Textiles
CSBR,Champions Oncology Inc. Common Stock,$4.86,-0.15,-2.994%,66065708.00,United States,,728,Health Care,Biotechnology: Biological Products (No Diagnostic Substances)
CSCO,Cisco Systems Inc. Common Stock (DE),$47.42,0.02,0.042%,191046396678.00,United States,1990,17029145,Telecommunications,Computer Communications Equipment
CSGP,CoStar Group Inc. Common Stock,$76.97,0.96,1.263%,31430108832.00,United States,1998,1677720,Consumer Discretionary,Business Services
CSGS,CSG Systems International Inc. Common Stock,$44.16,1.04,2.412%,1310275997.00,United States,1996,295629,Technology,EDP Services
CSIQ,Canadian Solar Inc. Common Shares (ON),$16.77,1.42,9.251%,1109482087.00,Canada,2006,2004530,Technology,Semiconductors
CSLM,CSLM Acquisition Corp. Class A Ordinary Share,$11.27,-0.01,-0.089%,0.00,United States,2022,9079,Finance,Blank Checks
CSLR,Complete Solaria Inc. Common Stock,$1.62,0.00,0.00%,79536390.00,United States,,247014,Technology,Semiconductors
CSLRW,Complete Solaria Inc. Warrants,$0.075,0.025,50.00%,3682240.00,United States,,48233,Technology,Semiconductors
CSPI,CSP Inc. Common Stock,$15.32,0.14,0.922%,149429748.00,United States,1982,21005,Technology,EDP Services
CSQ,Calamos Strategic Total Return Common Stock,$17.34,0.13,0.755%,2755111365.00,United States,2004,136084,Finance,Finance Companies
CSTE,Caesarstone Ltd. Ordinary Shares,$5.79,0.07,1.224%,199942897.00,Israel,2012,60424,Industrials,Building Materials
CSTL,Castle Biosciences Inc. Common Stock,$19.52,0.67,3.554%,538892212.00,United States,2019,464059,Health Care,Medical Specialities
CSWC,Capital Southwest Corporation Common Stock,$26.89,-0.05,-0.186%,1211414910.00,United States,,152803,Consumer Discretionary,Textiles
CSWCZ,Capital Southwest Corporation 7.75% Notes due 2028,$25.7871,0.0471,0.183%,1161728427.00,United States,,1852,Finance,Finance Companies
CSWI,CSW Industrials Inc. Common Stock,$301.28,13.18,4.575%,4678192385.00,United States,,99868,Industrials,Home Furnishings
CSX,CSX Corporation Common Stock,$35.33,0.73,2.11%,69067576633.00,United States,,13257076,Industrials,Railroads
CTAS,Cintas Corporation Common Stock,$725.45,10.60,1.483%,73606513987.00,United States,1983,386214,Consumer Discretionary,Apparel
CTBI,Community Trust Bancorp Inc. Common Stock,$48.33,2.25,4.883%,871200978.00,United States,,94679,Finance,Major Banks
CTCX,Carmell Corporation Common Stock,$1.52,-0.15,-8.982%,31620907.00,United States,2021,7802,Health Care,Medical/Dental Instruments
CTCXW,Carmell Corporation Warrant,$0.09,0.009,11.111%,1872291.00,United States,2021,2000,Health Care,Medical/Dental Instruments
CTHR,Charles & Colvard Ltd Common Stock,$1.88,-0.02,-1.053%,5704852.00,United States,1997,8112,Consumer Discretionary,Consumer Specialties
CTKB,Cytek Biosciences Inc. Common Stock,$6.66,0.33,5.213%,874277707.00,United States,2021,820179,Industrials,Biotechnology: Laboratory Analytical Instruments
CTLP,Cantaloupe Inc. Common Stock,$7.30,0.24,3.399%,531510905.00,United States,,298297,Miscellaneous,Office Equipment/Supplies/Services
CTMX,CytomX Therapeutics Inc. Common Stock,$1.51,0.10,7.092%,117658247.00,United States,2015,855994,Health Care,Biotechnology: Pharmaceutical Preparations
CTNM,Contineum Therapeutics Inc. Class A Common Stock,$21.75,0.75,3.571%,559481253.00,United States,2024,123852,Health Care,Biotechnology: Pharmaceutical Preparations
CTNT,Cheetah Net Supply Chain Service Inc. Class A Common Stock,$0.4939,0.0069,1.417%,16001535.00,United States,2023,1368906,Consumer Discretionary,Motor Vehicles
CTRM,Castor Maritime Inc. Common Shares,$4.75,0.25,5.556%,45896338.00,Cyprus,,84040,Consumer Discretionary,Marine Transportation
CTRN,Citi Trends Inc. Common Stock,$20.73,0.79,3.962%,178180507.00,United States,2005,209107,Consumer Discretionary,Clothing/Shoe/Accessory Stores
CTSH,Cognizant Technology Solutions Corporation Class A Common Stock,$73.79,1.36,1.878%,36688304470.00,United States,1998,2635148,Technology,EDP Services
CTSO,Cytosorbents Corporation Common Stock,$1.12,0.05,4.673%,60823185.00,United States,,136219,Health Care,Medical/Dental Instruments
CTXR,Citius Pharmaceuticals Inc. Common Stock,$0.85,0.0847,11.068%,153572352.00,United States,,3197049,Health Care,Biotechnology: Pharmaceutical Preparations
CUBA,Herzfeld Caribbean Basin Fund Inc. (The) Common Stock,$2.4203,0.0003,0.012%,0.00,United States,,88968,Finance,Investment Managers
CUBWU,Lionheart Holdings Unit,$9.97,0.00,0.00%,0.00,United States,2024,70582,Finance,Blank Checks
CUE,Cue Biopharma Inc. Common Stock,$0.932,0.002,0.215%,45335571.00,United States,2018,279864,Health Care,Biotechnology: Pharmaceutical Preparations
CULL,Cullman Bancorp Inc. Common Stock,$10.1187,0.0087,0.086%,73334013.00,United States,2021,3459,Finance,Banks
CURI,CuriosityStream Inc. Class A Common Stock,$1.17,0.02,1.739%,62710232.00,United States,2020,83226,Consumer Discretionary,Movies/Entertainment
CURIW,CuriosityStream Inc. Warrant,$0.02,-0.0002,-0.99%,1071970.00,United States,2020,6640,Consumer Discretionary,Movies/Entertainment
CUTR,Cutera Inc. Common Stock,$1.66,0.12,7.792%,33319679.00,United States,2004,564788,Health Care,Biotechnology: Electromedical & Electrotherapeutic Apparatus
CVAC,CureVac N.V. Ordinary Shares,$3.56,-0.04,-1.111%,797399683.00,Germany,2020,991273,Health Care,Biotechnology: Pharmaceutical Preparations
CVBF,CVB Financial Corporation Common Stock,$19.07,0.84,4.608%,2662928698.00,United States,,1501387,Finance,Major Banks
CVCO,Cavco Industries Inc. Common Stock When Issued,$410.75,29.04,7.608%,3402318239.00,United States,,113699,Consumer Discretionary,Homebuilding
CVGI,Commercial Vehicle Group Inc. Common Stock,$5.49,0.43,8.498%,188734248.00,United States,2004,137767,Consumer Discretionary,Auto Parts:O.E.M.
CVGW,Calavo Growers Inc. Common Stock,$23.73,1.69,7.668%,422396254.00,United States,,195911,Consumer Discretionary,Specialty Foods
CVII,Churchill Capital Corp VII Class A Common Stock,$10.78,0.00,0.00%,0.00,United States,,96364,Finance,Blank Checks
CVIIU,Churchill Capital Corp VII Units,$10.83,0.00,0.00%,,United States,,169,Finance,Blank Checks
CVIIW,Churchill Capital Corp VII Warrants,$0.35,0.00,0.00%,,United States,,515,Finance,Blank Checks
CVKD,Cadrenal Therapeutics Inc. Common Stock,$0.4504,-0.0035,-0.771%,7210214.00,United States,2023,117115,Health Care,Biotechnology: Pharmaceutical Preparations
CVLG,Covenant Logistics Group Inc. Class A Common Stock,$52.27,1.59,3.137%,685487597.00,United States,,63990,Industrials,Trucking Freight/Courier Services
CVLT,Commvault Systems Inc. Common Stock,$124.80,1.41,1.143%,5416471882.00,United States,2006,357741,Technology,Computer Software: Prepackaged Software
CVRX,CVRx Inc. Common Stock,$9.91,0.24,2.482%,214012158.00,United States,2021,292355,Health Care,Medical/Dental Instruments
CVV,CVD Equipment Corporation Common Stock,$4.00,0.07,1.781%,27298044.00,United States,,23540,Technology,Industrial Machinery/Components
CWBC,Community West Bancshares Common Stock,$21.50,1.35,6.70%,405708956.00,United States,,98036,Finance,Major Banks
CWCO,Consolidated Water Co. Ltd. Ordinary Shares,$28.88,1.60,5.865%,457139470.00,Cayman Islands,,147303,Utilities,Water Supply
CWD,CaliberCos Inc. Class A Common Stock,$0.7801,0.0101,1.312%,17027322.00,United States,2023,8975,Finance,Real Estate
CWST,Casella Waste Systems Inc. Class A Common Stock,$105.38,0.12,0.114%,6123445172.00,United States,1997,610440,Utilities,Environmental Services
CXAI,CXApp Inc. Class A Common Stock,$2.52,0.02,0.80%,38441060.00,United States,2021,170992,Technology,EDP Services
CXAIW,CXApp Inc. Warrant,$0.19,-0.0124,-6.126%,2898334.00,United States,2021,91002,Technology,EDP Services
CXDO,Crexendo Inc. Common Stock,$4.27,-0.04,-0.928%,113701654.00,United States,,347880,Telecommunications,Telecommunications Equipment
CYBR,CyberArk Software Ltd. Ordinary Shares,$276.10,0.79,0.287%,11666698270.00,Israel,2014,373135,Technology,Computer Software: Prepackaged Software
CYCC,Cyclacel Pharmaceuticals Inc. Common Stock,$1.7499,0.0099,0.569%,2560557.00,United States,,55119,Health Care,Biotechnology: Pharmaceutical Preparations
CYCCP,Cyclacel Pharmaceuticals Inc. 6% Convertible Preferred Stock,$9.29,0.00,0.00%,13593676.00,United States,,2,Health Care,Biotechnology: Pharmaceutical Preparations
CYCN,Cyclerion Therapeutics Inc. Common Stock,$2.9501,0.0301,1.031%,7995054.00,United States,,1825,Health Care,Biotechnology: Pharmaceutical Preparations
CYN,Cyngn Inc. Common Stock,$7.27,-1.91,-20.806%,10290154.00,United States,2021,1145887,Technology,EDP Services
CYRX,CryoPort Inc. Common Stock,$8.67,1.24,16.689%,427062039.00,United States,,1903847,Health Care,Biotechnology: Pharmaceutical Preparations
CYTH,Cyclo Therapeutics Inc. Common Stock,$1.22,0.02,1.667%,34911203.00,United States,,49722,Health Care,Biotechnology: Biological Products (No Diagnostic Substances)
CYTK,Cytokinetics Incorporated Common Stock,$56.76,-0.63,-1.098%,5951508386.00,United States,2004,1031885,Health Care,Biotechnology: Pharmaceutical Preparations
CYTO,Altamira Therapeutics Ltd. Common Shares,$1.39,0.04,2.963%,2054121.00,Bermuda,2014,32245,Health Care,Biotechnology: Pharmaceutical Preparations
CZFS,Citizens Financial Services Inc. Common Stock,$50.78,0.53,1.055%,241411268.00,United States,,29503,Finance,Major Banks
CZNC,Citizens & Northern Corp Common Stock,$20.74,1.25,6.414%,318900459.00,United States,,48638,Finance,Major Banks
CZR,Caesars Entertainment Inc. Common Stock,$39.77,0.55,1.402%,8606845867.00,United States,,5194600,Consumer Discretionary,Hotels/Resorts
CZWI,Citizens Community Bancorp Inc. Common Stock,$12.14,0.24,2.017%,126332980.00,United States,2006,13473,Finance,Savings Institutions
DADA,Dada Nexus Limited American Depositary Shares,$1.40,-0.03,-2.098%,369708977.00,China,2020,2245992,Technology,Computer Software: Programming Data Processing
DAIO,Data I/O Corporation Common Stock,$2.78,0.00,0.00%,25089875.00,United States,1981,12208,Industrials,Electrical Products
DAKT,Daktronics Inc. Common Stock,$15.15,0.60,4.124%,701390112.00,United States,1994,1262891,Consumer Discretionary,Miscellaneous manufacturing industries
DALN,DallasNews Corporation Series A Common Stock,$3.30,-0.0593,-1.765%,17663217.00,United States,,6444,Consumer Discretionary,Newspapers/Magazines
DARE,Dare Bioscience Inc. Common Stock,$3.40,0.02,0.592%,28642987.00,United States,2014,23296,Health Care,Biotechnology: Pharmaceutical Preparations
DASH,DoorDash Inc. Class A Common Stock,$108.74,3.09,2.925%,44465354140.00,United States,,4555726,Consumer Discretionary,Business Services
DATS,DatChat Inc. Common Stock,$1.86,-0.03,-1.587%,5597352.00,United States,2021,1878199,Telecommunications,Telecommunications Equipment
DATSW,DatChat Inc. Series A Warrant,$0.06,-0.0786,-56.71%,180560.00,United States,2021,239,Telecommunications,Telecommunications Equipment
DAVE,Dave Inc. Class A Common Stock,$41.68,3.14,8.147%,516263818.00,United States,,508971,Finance,Finance: Consumer Services
DAVEW,Dave Inc. Warrants,$0.037,0.0046,14.198%,458296.00,United States,,29494,Finance,Finance: Consumer Services
DAWN,Day One Biopharmaceuticals Inc. Common Stock,$16.01,0.31,1.975%,1399111643.00,United States,2021,1677528,Health Care,Biotechnology: Pharmaceutical Preparations
DBGI,Digital Brands Group Inc. Common Stock,$1.67,0.05,3.086%,3232317.00,United States,2021,32591,Consumer Discretionary,Clothing/Shoe/Accessory Stores
DBVT,DBV Technologies S.A. American Depositary Shares,$0.8258,-0.0059,-0.709%,79635502.00,France,2014,15847,Health Care,Biotechnology: Biological Products (No Diagnostic Substances)
DBX,Dropbox Inc. Class A Common Stock,$23.18,0.53,2.34%,7653855358.00,United States,2018,2952897,Technology,Computer Software: Prepackaged Software
DCBO,Docebo Inc. Common Shares,$38.85,0.88,2.318%,1180402510.00,Canada,,72973,Technology,Computer Software: Prepackaged Software
DCGO,DocGo Inc. Common Stock,$3.40,0.29,9.325%,345322839.00,United States,2020,1066079,Health Care,Medical/Nursing Services
DCOM,Dime Community Bancshares Inc. Common Stock,$24.19,1.12,4.855%,942685534.00,United States,,369205,Finance,Major Banks
DCOMG,Dime Community Bancshares Inc. 9.000% Fixed-to-Floating Rate Subordinated Notes due 2034,$25.89,0.03,0.116%,1008934620.00,United States,,17253,Finance,Major Banks
DCOMP,Dime Community Bancshares Inc. Fixed-Rate Non-Cumulative Perpetual Preferred Stock Series A,$17.85,0.20,1.133%,695615410.00,United States,,32106,Finance,Major Banks
DCTH,Delcath Systems Inc. Common Stock,$7.97,0.01,0.126%,221452850.00,United States,,156355,Health Care,Medical/Dental Instruments
DDI,DoubleDown Interactive Co. Ltd. American Depository Shares,$12.50,-0.10,-0.794%,619418000.00,South Korea,2021,10753,Technology,EDP Services
DDOG,Datadog Inc. Class A Common Stock,$130.77,1.355,1.047%,43742409645.00,United States,2019,3156341,Technology,Computer Software: Prepackaged Software
DECA,Denali Capital Acquisition Corp. Class A Ordinary Shares,$11.47,-0.01,-0.087%,0.00,United States,2022,14941,Finance,Blank Checks
DECAU,Denali Capital Acquisition Corp. Unit,$11.34,0.00,0.00%,0.00,United States,2022,58,Finance,Blank Checks
DECAW,Denali Capital Acquisition Corp. Warrant,$0.04,0.00,0.00%,0.00,United States,2022,36650,Finance,Blank Checks
DENN,Denny's Corporation Common Stock,$7.51,0.37,5.182%,390659558.00,United States,,595174,Consumer Discretionary,Restaurants
DERM,Journey Medical Corporation Common Stock,$5.91,0.09,1.546%,118276215.00,United States,2021,106077,Health Care,Biotechnology: Pharmaceutical Preparations
DFLI,Dragonfly Energy Holdings Corp. Common Stock (NV),$0.889,-0.0212,-2.329%,53792924.00,United States,2021,203778,Miscellaneous,Industrial Machinery/Components
DFLIW,Dragonfly Energy Holdings Corp. Warrant,$0.05,-0.0209,-29.478%,3025474.00,United States,2021,45142,Miscellaneous,Industrial Machinery/Components
DGHI,Digihost Technology Inc. Common Subordinate Voting Shares,$1.52,0.05,3.401%,45600530.00,Canada,,139026,Finance,Finance: Consumer Services
DGICA,Donegal Group Inc. Class A Common Stock,$13.98,0.22,1.599%,466840137.00,United States,,73916,Finance,Property-Casualty Insurers
DGICB,Donegal Group Inc. Class B Common Stock,$11.8286,0.2886,2.501%,394997514.00,United States,1986,1509,Finance,Property-Casualty Insurers
DGII,Digi International Inc. Common Stock,$24.99,1.42,6.025%,909001129.00,United States,1989,264691,Telecommunications,Computer Communications Equipment
DGLY,Digital Ally Inc. Common Stock,$2.325,-0.105,-4.321%,6695595.00,United States,,96062,Technology,Radio And Television Broadcasting And Communications Equipment
DH,Definitive Healthcare Corp. Class A Common Stock,$5.87,0.37,6.727%,692276765.00,United States,2021,349914,Technology,Computer Software: Prepackaged Software
DHAI,DIH Holdings US Inc. Class A Common Stock,$3.245,0.155,5.016%,131568314.00,United States,2024,16552,Health Care,Medical/Dental Instruments
DHAIW,DIH Holding US Inc. Warrants,$0.047,-0.0009,-1.879%,1905612.00,United States,2024,1860,Health Care,Medical/Dental Instruments
DHC,Diversified Healthcare Trust Common Shares of Beneficial Interest,$3.43,0.08,2.388%,824550466.00,United States,,1168617,Real Estate,Real Estate Investment Trusts
DHCNI,Diversified Healthcare Trust 5.625% Senior Notes due 2042,$14.02,0.09,0.646%,3370319982.00,United States,,24385,Real Estate,Real Estate Investment Trusts
DHCNL,Diversified Healthcare Trust 6.25% Senior Notes Due 2046,$15.0501,0.0401,0.267%,3617949555.00,United States,,15332,Real Estate,Real Estate Investment Trusts
DHIL,Diamond Hill Investment Group Inc. Class A Common Stock,$153.11,4.00,2.683%,424557188.00,United States,,19232,Finance,Investment Managers
DIBS,1stdibs.com Inc. Common Stock,$4.79,0.18,3.905%,188610192.00,United States,2021,64648,Consumer Discretionary,Catalog/Specialty Distribution
DIOD,Diodes Incorporated Common Stock,$85.82,2.00,2.386%,3958267621.00,United States,,475095,Technology,Semiconductors
DIST,Distoken Acquisition Corporation Ordinary Shares,$10.79,0.05,0.466%,0.00,China,2023,50706,Finance,Blank Checks
DJCO,Daily Journal Corp. (S.C.) Common Stock,$447.86,15.36,3.551%,616714864.00,United States,,29822,Consumer Discretionary,Newspapers/Magazines
DJT,Trump Media & Technology Group Corp. Common Stock,$36.89,-3.69,-9.093%,6518484507.00,United States,2024,17572566,Technology,Computer Software: Programming Data Processing
DJTWW,Trump Media & Technology Group Corp. Warrants,$25.30,-3.75,-12.909%,4470524750.00,United States,2021,399378,Technology,Computer Software: Programming Data Processing
DKNG,DraftKings Inc. Class A Common Stock,$39.81,0.33,0.836%,18958465218.00,United States,2019,7052883,Consumer Discretionary,Services-Misc. Amusement & Recreation
DLHC,DLH Holdings Corp.,$11.92,0.64,5.674%,169656061.00,United States,,24967,Consumer Discretionary,Professional Services
DLO,DLocal Limited Class A Common Shares,$8.17,0.14,1.743%,2418251903.00,Uruguay,2021,1422084,Consumer Discretionary,Business Services
DLPN,Dolphin Entertainment Inc. Common Stock,$0.9112,-0.0038,-0.415%,17271716.00,United States,,24451,Consumer Discretionary,Other Consumer Services
DLTH,Duluth Holdings Inc. Class B Common Stock,$3.83,-0.06,-1.542%,134300834.00,United States,2015,68835,Consumer Discretionary,Clothing/Shoe/Accessory Stores
DLTR,Dollar Tree Inc. Common Stock,$104.82,0.99,0.953%,22530430080.00,United States,1995,2913233,Consumer Discretionary,Department/Specialty Retail Stores
DMAC,DiaMedica Therapeutics Inc. Common Stock,$3.39,-0.19,-5.307%,128697675.00,United States,2018,22081,Health Care,Biotechnology: Pharmaceutical Preparations
DMLP,Dorchester Minerals L.P. Common Units Representing Limited Partnership Interests,$32.64,0.09,0.276%,1308492296.00,United States,,34115,Energy,Oil & Gas Production
DMRC,Digimarc Corporation Common Stock,$34.48,1.11,3.326%,736952177.00,United States,,143039,Technology,EDP Services
DNLI,Denali Therapeutics Inc. Common Stock,$23.94,0.61,2.615%,3414060322.00,United States,2017,1197664,Health Care,Biotechnology: Biological Products (No Diagnostic Substances)
DNTH,Dianthus Therapeutics Inc. Common Stock,$28.50,-0.50,-1.724%,836459867.00,United States,2018,128903,Health Care,Biotechnology: Pharmaceutical Preparations
DNUT,Krispy Kreme Inc. Common Stock,$11.04,0.38,3.565%,1862448000.00,United States,2021,1509172,Consumer Staples,Food Chains
DOCU,DocuSign Inc. Common Stock,$56.90,-0.235,-0.411%,11648360543.00,United States,1989,1965607,Technology,Computer Software: Prepackaged Software
DOGZ,Dogness (International) Corporation Class A Common Stock,$15.71,0.40,2.613%,166867897.00,China,2017,13528,Consumer Discretionary,Miscellaneous manufacturing industries
DOMH,Dominari Holdings Inc. Common Stock,$1.86,0.00,0.00%,11038946.00,United States,,27466,Health Care,Biotechnology: Pharmaceutical Preparations
DOMO,Domo Inc. Class B Common Stock,$8.075,-0.095,-1.163%,308260727.00,United States,2018,380294,Technology,Computer Software: Prepackaged Software
DOOO,BRP Inc. (Recreational Products) Common Subordinate Voting Shares,$70.89,2.14,3.113%,5313664087.00,Canada,,73871,Consumer Discretionary,Industrial Specialties
DORM,Dorman Products Inc. Common Stock,$102.83,6.33,6.56%,3189063911.00,United States,,179345,Consumer Discretionary,Auto Parts:O.E.M.
DOX,Amdocs Limited Ordinary Shares,$82.80,1.75,2.159%,9716399413.00,Guernsey,,604308,Technology,EDP Services
DOYU,DouYu International Holdings Limited ADS,$16.66,-0.19,-1.128%,527048663.00,China,2019,178570,Technology,Computer Software: Programming Data Processing
DPCS,DP Cap Acquisition Corp I Class A Ordinary Shares,$11.30,0.00,0.00%,0.00,United States,2021,1,Finance,Blank Checks
DPCSW,DP Cap Acquisition Corp I Warrants,$0.04,-0.0038,-8.676%,0.00,United States,2021,100,Finance,Blank Checks
DPRO,Draganfly Inc. Common Shares,$0.235,0.01,4.444%,14897407.00,Canada,,874193,Industrials,Aerospace
DRCT,Direct Digital Holdings Inc. Class A Common Stock,$4.86,0.62,14.623%,69354266.00,United States,2022,444680,Consumer Discretionary,Advertising
DRIO,DarioHealth Corp. Common Stock,$1.35,-0.10,-6.897%,40396388.00,Israel,,245714,Health Care,Medical/Dental Instruments
DRMA,Dermata Therapeutics Inc. Common Stock,$2.00,-0.19,-8.676%,888112.00,United States,2021,72095,Health Care,Biotechnology: Pharmaceutical Preparations
DRRX,DURECT Corporation Common Stock,$1.36,0.01,0.741%,42213558.00,United States,2000,25463,Health Care,Biotechnology: Pharmaceutical Preparations
DRS,Leonardo DRS Inc. Common Stock,$28.37,1.14,4.187%,7465341434.00,Israel,,779816,Industrials,Industrial Machinery/Components
DRTS,Alpha Tau Medical Ltd. Ordinary Shares,$2.1399,0.0199,0.939%,149088143.00,Israel,,17444,Health Care,Medical/Dental Instruments
DRTSW,Alpha Tau Medical Ltd. Warrant,$0.25,0.00,0.00%,17417653.00,Israel,,5000,Health Care,Medical/Dental Instruments
DRUG,Bright Minds Biosciences Inc. Common Stock,$1.25,0.23,22.549%,5579796.00,Canada,,150815,Health Care,Biotechnology: Pharmaceutical Preparations
DRVN,Driven Brands Holdings Inc. Common Stock,$13.68,0.20,1.484%,2244611459.00,United States,2021,1477912,Consumer Discretionary,Automotive Aftermarket
DSGN,Design Therapeutics Inc. Common Stock,$4.55,0.07,1.563%,257052427.00,United States,2021,213114,Health Care,Biotechnology: Pharmaceutical Preparations
DSGR,Distribution Solutions Group Inc. Common Stock,$33.44,2.31,7.42%,1565286305.00,United States,,73578,Consumer Discretionary,Industrial Specialties
DSGX,Descartes Systems Group Inc. (The) Common Stock,$103.93,0.88,0.854%,8874597458.00,Canada,,135320,Technology,Computer Software: Prepackaged Software
DSP,Viant Technology Inc. Class A Common Stock,$11.11,0.23,2.114%,705424906.00,United States,2021,191620,Technology,Computer Software: Programming Data Processing
DSWL,Deswell Industries Inc. Common Shares,$2.38,0.04,1.709%,37925869.00,Macau,1995,23165,Industrials,Plastic Products
DSY,Big Tree Cloud Holdings Limited Ordinary Shares,$1.40,0.00,0.00%,79912764.00,China,,29088,Consumer Discretionary,Containers/Packaging
DSYWW,Big Tree Cloud Holdings Limited Warrants,$0.059,0.0076,14.786%,3367752.00,China,,126828,Consumer Discretionary,Containers/Packaging
DTCK,Davis Commodities Limited Ordinary Shares,$1.14,-0.05,-4.202%,27930713.00,Singapore,2023,161989,Industrials,Farming/Seeds/Milling
DTI,Drilling Tools International Corporation Common Stock,$5.69,0.06,1.066%,169383152.00,United States,2021,63120,Industrials,Metal Fabrications
DTIL,Precision BioSciences Inc. Common Stock,$10.38,0.14,1.367%,71887707.00,United States,2019,59177,Health Care,Biotechnology: Biological Products (No Diagnostic Substances)
DTSS,Datasea Inc. Common Stock,$2.97,0.04,1.365%,9082094.00,China,,27504,Technology,Computer Software: Prepackaged Software
DTST,Data Storage Corporation Common Stock,$6.42,0.03,0.469%,44753454.00,United States,,87399,Technology,EDP Services
DTSTW,Data Storage Corporation Warrant,$1.18,-0.01,-0.84%,8225713.00,United States,,8924,Technology,EDP Services
DUET,DUET Acquisition Corp. Class A Common Stock,$11.13,0.00,0.00%,0.00,Malaysia,2022,1,Finance,Blank Checks
DUO,Fangdd Network Group Ltd. American Depositary Shares,$0.516,-0.0195,-3.641%,3101467.00,China,2019,182641,Finance,Real Estate
DUOL,Duolingo Inc. Class A Common Stock,$187.30,-4.75,-2.473%,8076772701.00,United States,2021,604392,Technology,Computer Software: Prepackaged Software
